nohup: 입력 무시
Updating module_config in conf/train_asr.yaml...
Updated conf/train_asr.yaml with module_config:
  Configuration: ['I', 'M', 'M', 'I', 'I', 'I']
  Applied to 12 blocks
YAML file updated successfully.
2025-11-24T17:29:07 (asr.sh:285:main) ./asr.sh --lang en --ngpu 1 --nj 16 --gpu_inference true --inference_nj 4 --nbpe 5000 --max_wav_duration 30 --audio_format flac.ark --speed_perturb_factors 0.9 1.0 1.1 --feats_type raw --use_lm false --asr_config conf/train_asr.yaml --inference_config conf/decode_asr.yaml --train_set train_clean_100 --valid_set dev --test_sets test_other --inference_asr_model valid.cer_ctc.ave_5best.pth --lm_train_text data/train_clean_100/text --bpe_train_text data/train_clean_100/text --stage 12 --stop_stage 13
2025-11-24T17:29:08 (asr.sh:566:main) Skipped stages:  6 7 8 9 14 15 
2025-11-24T17:29:08 (asr.sh:1513:main) Stage 12: Decoding: training_dir=exp/asr_train_asr_raw_en_bpe5000_sp
2025-11-24T17:29:08 (asr.sh:1541:main) Generate 'exp/asr_train_asr_raw_en_bpe5000_sp/decode_asr_asr_model_valid.cer_ctc.ave_5best/run.sh'. You can resume the process from stage 12 using this script
2025-11-24T17:29:08 (asr.sh:1606:main) Decoding started... log: 'exp/asr_train_asr_raw_en_bpe5000_sp/decode_asr_asr_model_valid.cer_ctc.ave_5best/test_other/logdir/asr_inference.*.log'
2025-11-24T18:13:45 (asr.sh:1622:main) Calculating RTF & latency... log: 'exp/asr_train_asr_raw_en_bpe5000_sp/decode_asr_asr_model_valid.cer_ctc.ave_5best/test_other/logdir/calculate_rtf.log'
2025-11-24T18:13:45 (asr.sh:1654:main) Stage 13: Scoring
/home/bossjung/anaconda3/envs/espnet/bin/python3 /home/bossjung/espnet/espnet/espnet2/bin/tokenize_text.py -f 2- --input - --output - --cleaner none --token_type char --non_linguistic_symbols none --remove_non_linguistic_symbols true
/home/bossjung/anaconda3/envs/espnet/bin/python3 /home/bossjung/espnet/espnet/espnet2/bin/tokenize_text.py -f 2- --input - --output - --token_type char --non_linguistic_symbols none --remove_non_linguistic_symbols true --cleaner none
2025-11-24T18:14:02 (asr.sh:1744:main) Write cer result in exp/asr_train_asr_raw_en_bpe5000_sp/decode_asr_asr_model_valid.cer_ctc.ave_5best/test_other/score_cer/result.txt
|   SPKR      |   # Snt       # Wrd    |   Corr         Sub        Del         Ins         Err       S.Err    |
|   Sum/Avg   |   2939       272758    |   85.5         7.1        7.4         4.0        18.5        94.9    |
/home/bossjung/anaconda3/envs/espnet/bin/python3 /home/bossjung/espnet/espnet/espnet2/bin/tokenize_text.py -f 2- --input - --output - --cleaner none --token_type word --non_linguistic_symbols none --remove_non_linguistic_symbols true
/home/bossjung/anaconda3/envs/espnet/bin/python3 /home/bossjung/espnet/espnet/espnet2/bin/tokenize_text.py -f 2- --input - --output - --token_type word --non_linguistic_symbols none --remove_non_linguistic_symbols true --cleaner none
2025-11-24T18:14:12 (asr.sh:1744:main) Write wer result in exp/asr_train_asr_raw_en_bpe5000_sp/decode_asr_asr_model_valid.cer_ctc.ave_5best/test_other/score_wer/result.txt
|   SPKR      |   # Snt       # Wrd    |   Corr         Sub        Del         Ins         Err       S.Err    |
|   Sum/Avg   |   2939        52343    |   70.2        25.7        4.1         3.5        33.3        94.9    |
/home/bossjung/anaconda3/envs/espnet/bin/python3 /home/bossjung/espnet/espnet/espnet2/bin/tokenize_text.py -f 2- --input - --output - --cleaner none --token_type bpe --bpemodel data/en_token_list/bpe_unigram5000/bpe.model
/home/bossjung/anaconda3/envs/espnet/bin/python3 /home/bossjung/espnet/espnet/espnet2/bin/tokenize_text.py -f 2- --input - --output - --token_type bpe --bpemodel data/en_token_list/bpe_unigram5000/bpe.model --cleaner none
2025-11-24T18:14:22 (asr.sh:1744:main) Write ter result in exp/asr_train_asr_raw_en_bpe5000_sp/decode_asr_asr_model_valid.cer_ctc.ave_5best/test_other/score_ter/result.txt
|   SPKR      |   # Snt       # Wrd    |   Corr         Sub        Del         Ins         Err       S.Err    |
|   Sum/Avg   |   2939        66853    |   67.8        21.7       10.6         3.7        36.0        94.9    |
<!-- Generated by scripts/utils/show_asr_result.sh -->
# RESULTS
## Environments
- date: `Mon Nov 24 18:14:23 KST 2025`
- python version: `3.9.19 (tags/v3.9.19-26-g2d3a350f043-dirty:2d3a350f043, May 25 2024, 00:41:40)  [GCC 13.2.0]`
- espnet version: `espnet 202509`
- pytorch version: `pytorch 2.7.1+cu126`
- Git hash: `849b210c2d326867afdf73d0460de7ee2d5dcf6f`
  - Commit date: `Wed Oct 8 07:31:40 2025 -0400`

## exp/asr_train_asr_raw_en_bpe5000_sp
### WER

|dataset|Snt|Wrd|Corr|Sub|Del|Ins|Err|S.Err|
|---|---|---|---|---|---|---|---|---|
|decode_asr_asr_model_valid.cer_ctc.ave_5best/test_other|2939|52343|70.2|25.7|4.1|3.5|33.3|94.9|

### CER

|dataset|Snt|Wrd|Corr|Sub|Del|Ins|Err|S.Err|
|---|---|---|---|---|---|---|---|---|
|decode_asr_asr_model_valid.cer_ctc.ave_5best/test_other|2939|272758|85.5|7.1|7.4|4.0|18.5|94.9|

### TER

|dataset|Snt|Wrd|Corr|Sub|Del|Ins|Err|S.Err|
|---|---|---|---|---|---|---|---|---|
|decode_asr_asr_model_valid.cer_ctc.ave_5best/test_other|2939|66853|67.8|21.7|10.6|3.7|36.0|94.9|

2025-11-24T18:14:24 (asr.sh:1842:main) Successfully finished. [elapsed=2717s]
